{
  "name": "codex",
  "kind": "tool-adapter",
  "displayName": "Codex",
  "status": "active",
  "supportedTargets": [
    "codex"
  ],
  "renders": [
    "task-packet",
    "role",
    "hook",
    "skill",
    "pack",
    "mcp-config"
  ],
  "entrypoints": [
    "scripts/aok",
    ".codex-plugin/plugin.json",
    "hooks.json",
    "skills/",
    "packs/*/pack.json"
  ],
  "limitations": [
    "Neutral manifest to Codex skill generation is currently curated manually.",
    "Bundle metadata is expected from the native Codex plugin manifest at .codex-plugin/plugin.json; pack renders should preserve targetRender.codex as a Codex native plugin bundle."
  ],
  "supportLevel": "native-install",
  "nativePackageFormats": [
    "codex-plugin"
  ],
  "bundle": {
    "artifactName": "agent-operating-kit-<version>-{macos-apple-silicon,macos-intel,windows}-installer.zip / linux-{user,system}-installer.tar.gz",
    "format": "codex-plugin-bundle",
    "importInstructions": "Install the AOK release installer for your platform (macOS Apple Silicon, macOS Intel, Windows, Linux user, or Linux system) or import this Codex plugin-oriented bundle."
  }
}
